,title,link,synopsis
106,Spoor Hears Reports,[Spoor Hears Reports](../synopsis/spoor_hears_reports.md),Spoor hears alarming reports of gun running. He imposes a tight air and sea blockade around the entire archipelago.
126,Spoor Orders Night Patrol,[Spoor Orders Night Patrol](../synopsis/spoor_orders_night_patrol.md),Spoor orders a night patrol not to engage a blockade running POAS flight because he knows that it carries civilian passengers.
101,Spoor Pissed At Bob,[Spoor Pissed At Bob](../synopsis/spoor_pissed_at_bob.md),Victor overhears Spoor ranting about RI-002 blockade runs.
174,Spoor Poisoned,[Spoor Poisoned](../synopsis/spoor_poisoned.md),Spoor dies after a seafood lunch in which his dining companions also suffered food poisoning.
49,Spoor Takes Command,[Spoor Takes Command](../synopsis/spoor_takes_command.md),"Spoor relocates from Australia to Batavia and takes command of KNIL, with Julius Tahija as his adjudant."
73,Spoor Takes Offense,[Spoor Takes Offense](../synopsis/spoor_takes_offense.md),
7,Subjects Of The Queen,[Subjects Of The Queen](../synopsis/subjects_of_the_queen.md),Dutch diplomats in Manila claim ownership of the RI-002 cargo – and the crew!
171,Surprise Call,[Surprise Call](../synopsis/surprise_call.md),"Muharto receives an unexpected telephone call from Pang Soeparto in Tasik, telling him of a foreigner landing on Cilotok beach."
35,Suryadarma Takes Fowlers Fuel Allowance,[Suryadarma Takes Fowlers Fuel Allowance](../synopsis/suryadarma_takes_fowlers_fuel_allowance.md),Suryadarma takes away Fowler’s and Bob’s fuel allowances
62,Suryadarma Takes Fuel Allowance,[Suryadarma Takes Fuel Allowance](../synopsis/suryadarma_takes_fuel_allowance.md),"In a whiskey-soaked conversation with Muharto and Fowler, Bob disparages Indonesians."
129,Thai Authorities Release Freeberg,[Thai Authorities Release Freeberg](../synopsis/thai_authorities_released_freeberg.md),Spoor is furious to learn that Thai authorities have released Freeberg.
16,Thai Massage,[Thai Massage](../synopsis/thai_massage.md),"Bob is detained on arrival in Bangkok on request of Dutch diplomats, but Thai authorities conclude he is a legitimate businessman and free to come and go."
48,Third Cali Run,[Third Cali Run](../synopsis/third_cali_run.md),Muharto guides Bob Freeberg to Jogja during a blockade run from Singapore.
15,Tom Lee In Jogja,[Tom Lee In Jogja](../synopsis/tom_lee_in_jogja.md),
159,Tom Lee Treats,[Tom Lee Treats](../synopsis/tom_lee_treats.md),"Boedi and Muharto enjoy a brief respite from their meager diet when Tom Lee invites them for drinks and dinner, during which he pumps them for information about the military and political situation in the Republic."
4,Unorthodox Request,[Unorthodox Request](../synopsis/unorthodox_request.md),
52,Useful Idiot,[Useful Idiot](../synopsis/useful_idiot.md),
83,Victor Arrives,[Victor Arrives](../synopsis/victor_arrives.md),"Victor arrives in Batavia, and demonstates ability in both photography and the Indonesian language."
114,Victor Assigned To Spoor,[Victor Assigned To Spoor](../synopsis/victor_assigned_to_spoor.md),Victor is surprised to learn he is being transferred from the mapping department to Spoor’s office at KNIL headquarters.
5,Victor Defects,[Victor Defects](../synopsis/victor_defects.md),A Republican operative approaches Victor with the information that Emeria is waiting in the hills for him to defect.
88,Victor Learns Truth,[Victor Learns Truth](../synopsis/victor_learns_truth.md),Cameron tells Victor that Emeria was just using him to get information on Spoors activities.
53,Victor Meets Emeria,[Victor Meets Emeria](../synopsis/victor_meets_emeria.md),"Emeria contacts Victor in response to his lauditory review, and invites him to her studio, where she seduces him."
157,Victor Meets Koke,[Victor Meets Koke](../synopsis/victor_meets_koke.md),
144,Victor Meets Robert Koke,[Victor Meets Robert Koke](../synopsis/victor_meets_robert_koke.md),"Victor meets Robert Koke in Spoors office, and later learns he is an officer in the newly formed CIA."
149,Victor Writes About Art,[Victor Writes About Art](../synopsis/victor_writes_about_art.md),"Victor attends art exhibitions, and is invited to submit reviews to local newspapers."
115,Vt-CLA Crashes,[Vt-CLA Crashes](../synopsis/vt-cla_crashes.md),"Muharto and Boedi listen in horror to radio reports that VT-CLA, an Indian-registered Dakota that had made many blockade runs, had been shot down on approach to Maguwo."
74,Wins Quinine Case,[Wins Quinine Case](../synopsis/wins_quinine_case.md),"The court rules in favor of the Republicans, allowing Muharto to offer the the quinine for sale."
